{
  "$schema": "http://json-schema.org/draft-07/schema#",
  "title": "Cosmos LP Generator Config Schema",
  "description": "Schema de validação para arquivos config.js",
  "type": "object",
  "required": ["theme", "site"],
  "properties": {
    "theme": {
      "type": "object",
      "required": ["colors", "fonts"],
      "properties": {
        "colors": {
          "type": "object",
          "required": ["primary", "background"],
          "properties": {
            "primary": {
              "type": "string",
              "description": "Cor primária (hexadecimal ou nome Tailwind)",
              "pattern": "^#([A-Fa-f0-9]{6}|[A-Fa-f0-9]{3})$|^[a-z-]+$"
            },
            "secondary": {
              "type": "string",
              "description": "Cor secundária"
            },
            "tertiary": {
              "type": "string",
              "description": "Cor terciária"
            },
            "accent": {
              "type": "string",
              "description": "Cor de destaque"
            },
            "background": {
              "type": "string",
              "description": "Cor de fundo"
            },
            "text": {
              "type": "object",
              "properties": {
                "dark": { "type": "string" },
                "medium": { "type": "string" },
                "light": { "type": "string" },
                "white": { "type": "string" }
              }
            }
          }
        },
        "fonts": {
          "type": "object",
          "required": ["primary", "secondary"],
          "properties": {
            "primary": { "type": "string" },
            "secondary": { "type": "string" },
            "urls": {
              "type": "object",
              "properties": {
                "google": { "type": "string", "format": "uri" }
              }
            }
          }
        }
      }
    },
    "site": {
      "type": "object",
      "required": ["title", "name"],
      "properties": {
        "title": { "type": "string" },
        "name": { "type": "string" },
        "established": { "type": "string" },
        "logoAlt": { "type": "string" },
        "logoUrl": { "type": "string", "format": "uri" },
        "logoFallback": { "type": "string", "format": "uri" }
      }
    },
    "contact-top-bar": {
      "type": "object",
      "required": ["infoItems", "socialLinks"],
      "properties": {
        "infoItems": {
          "type": "array",
          "items": {
            "type": "object",
            "required": ["icon", "text"],
            "properties": {
              "icon": { "type": "string" },
              "text": { "type": "string" }
            }
          }
        },
        "socialLinks": {
          "type": "array",
          "items": {
            "type": "object",
            "required": ["icon", "href"],
            "properties": {
              "icon": { "type": "string" },
              "href": { "type": "string", "format": "uri" }
            }
          }
        },
        "colors": {
          "type": "object",
          "properties": {
            "background": { "type": "string" },
            "primary": { "type": "string" }
          }
        }
      }
    },
    "hero-image-badge": {
      "type": "object",
      "required": ["title", "titleHighlight", "description", "imageUrl"],
      "properties": {
        "tag": { "type": "string" },
        "tagIcon": { "type": "string" },
        "title": { "type": "string" },
        "titleHighlight": { "type": "string" },
        "description": { "type": "string" },
        "buttons": {
          "type": "array",
          "items": {
            "type": "object",
            "properties": {
              "text": { "type": "string" },
              "href": { "type": "string" },
              "class": { "type": "string" },
              "icon": { "type": "string" }
            }
          }
        },
        "rating": {
          "type": "object",
          "properties": {
            "stars": { "type": "number", "minimum": 1, "maximum": 5 },
            "text": { "type": "string" }
          }
        },
        "imageUrl": { "type": "string", "format": "uri" },
        "imageAlt": { "type": "string" },
        "badge": {
          "type": "object",
          "properties": {
            "icon": { "type": "string" },
            "title": { "type": "string" },
            "text": { "type": "string" }
          }
        }
      }
    },
    "info-bar": {
      "type": "object",
      "required": ["items"],
      "properties": {
        "items": {
          "type": "array",
          "items": {
            "type": "object",
            "required": ["icon", "text"],
            "properties": {
              "icon": { "type": "string" },
              "text": { "type": "string" }
            }
          }
        }
      }
    },
    "pricing-grid-highlight": {
      "type": "object",
      "required": ["title", "plans"],
      "properties": {
        "id": { "type": "string" },
        "title": { "type": "string" },
        "subtitle": { "type": "string" },
        "plans": {
          "type": "array",
          "items": {
            "type": "object",
            "required": ["name", "price", "features"],
            "properties": {
              "name": { "type": "string" },
              "price": { "type": "string" },
              "period": { "type": "string" },
              "description": { "type": "string" },
              "features": { "type": "array", "items": { "type": "string" } },
              "button": {
                "type": "object",
                "properties": {
                  "text": { "type": "string" },
                  "href": { "type": "string" }
                }
              },
              "highlighted": { "type": "boolean" },
              "badge": { "type": "string" }
            }
          }
        }
      }
    },
    "footer-contact": {
      "type": "object",
      "required": ["address", "contact"],
      "properties": {
        "title": { "type": "string" },
        "address": {
          "type": "object",
          "required": ["street", "city"],
          "properties": {
            "label": { "type": "string" },
            "street": { "type": "string" },
            "city": { "type": "string" },
            "zipCode": { "type": "string" },
            "mapQuery": { "type": "string" }
          }
        },
        "contact": {
          "type": "object",
          "required": ["phone"],
          "properties": {
            "label": { "type": "string" },
            "phone": { "type": "string" }
          }
        },
        "socialLinks": {
          "type": "array",
          "items": {
            "type": "object",
            "required": ["icon", "href"],
            "properties": {
              "icon": { "type": "string" },
              "href": { "type": "string", "format": "uri" },
              "label": { "type": "string" }
            }
          }
        },
        "copyright": { "type": "string" },
        "tags": {
          "type": "array",
          "items": { "type": "string" }
        }
      }
    },
    "whatsapp-float-button": {
      "type": "object",
      "required": ["href"],
      "properties": {
        "icon": { "type": "string" },
        "text": { "type": "string" },
        "href": { "type": "string", "format": "uri" },
        "color": { "type": "string" }
      }
    },
    "navbar-ecommerce-advanced": {
      "type": "object",
      "required": ["logoText"],
      "properties": {
        "logoText": { "type": "string" },
        "logoUrl": { "type": "string", "format": "uri" },
        "logoAlt": { "type": "string" },
        "logoIcon": { "type": "string" },
        "searchPlaceholder": { "type": "string" },
        "categories": {
          "type": "array",
          "items": {
            "type": "object",
            "required": ["text"],
            "properties": {
              "text": { "type": "string" },
              "href": { "type": "string" },
              "highlight": { "type": "boolean" }
            }
          }
        },
        "actions": {
          "type": "object",
          "properties": {
            "favorites": { "type": "object", "properties": { "href": { "type": "string" } } },
            "account": { "type": "object", "properties": { "href": { "type": "string" } } },
            "cart": { "type": "object", "properties": { "href": { "type": "string" }, "count": { "type": "number" } } }
          }
        },
        "colors": { "type": "object" }
      }
    },
    "hero-product-showcase": {
      "type": "object",
      "required": ["title", "imageUrl"],
      "properties": {
        "badges": {
          "type": "array",
          "items": {
            "type": "object",
            "required": ["text"],
            "properties": {
              "text": { "type": "string" },
              "style": { "type": "string", "enum": ["solid", "outline"] }
            }
          }
        },
        "title": { "type": "string" },
        "titleHighlight": { "type": "string" },
        "description": { "type": "string" },
        "price": {
          "type": "object",
          "properties": {
            "value": { "type": "string" },
            "installments": { "type": "string" }
          }
        },
        "rating": {
          "type": "object",
          "properties": {
            "value": { "type": "string" },
            "stars": { "type": "number", "minimum": 0, "maximum": 5 }
          }
        },
        "buttons": {
          "type": "array",
          "items": {
            "type": "object",
            "required": ["text", "href"],
            "properties": {
              "text": { "type": "string" },
              "href": { "type": "string" },
              "primary": { "type": "boolean" },
              "icon": { "type": "string" }
            }
          }
        },
        "imageUrl": { "type": "string", "format": "uri" },
        "imageAlt": { "type": "string" },
        "specs": {
          "type": "array",
          "items": {
            "type": "object",
            "required": ["icon", "value", "label"],
            "properties": {
              "icon": { "type": "string" },
              "value": { "type": "string" },
              "label": { "type": "string" }
            }
          }
        },
        "colors": { "type": "object" }
      }
    },
    "store-concept-section": {
      "type": "object",
      "required": ["title", "features"],
      "properties": {
        "tag": { "type": "string" },
        "title": { "type": "string" },
        "description": { "type": "string" },
        "features": {
          "type": "array",
          "items": {
            "type": "object",
            "required": ["icon", "title", "description"],
            "properties": {
              "icon": { "type": "string" },
              "title": { "type": "string" },
              "description": { "type": "string" },
              "iconBg": { "type": "string" },
              "iconColor": { "type": "string" }
            }
          }
        },
        "colors": { "type": "object" }
      }
    },
    "promo-countdown-banner": {
      "type": "object",
      "required": ["title", "couponCode"],
      "properties": {
        "emoji": { "type": "string" },
        "title": { "type": "string" },
        "description": { "type": "string" },
        "couponCode": { "type": "string" },
        "countdown": {
          "type": ["object", "boolean"],
          "properties": {
            "hours": { "type": "number" },
            "minutes": { "type": "number" },
            "seconds": { "type": "number" }
          }
        },
        "colors": { "type": "object" }
      }
    },
    "category-carousel": {
      "type": "object",
      "required": ["categories"],
      "properties": {
        "title": { "type": "string" },
        "categories": {
          "type": "array",
          "items": {
            "type": "object",
            "required": ["imageUrl", "title"],
            "properties": {
              "imageUrl": { "type": "string", "format": "uri" },
              "imageAlt": { "type": "string" },
              "title": { "type": "string" },
              "href": { "type": "string" },
              "subtitle": { "type": "string" }
            }
          }
        },
        "colors": { "type": "object" }
      }
    },
    "product-filters-bar": {
      "type": "object",
      "properties": {
        "tabs": {
          "type": "array",
          "items": {
            "type": "object",
            "required": ["text"],
            "properties": {
              "text": { "type": "string" },
              "active": { "type": "boolean" },
              "href": { "type": "string" }
            }
          }
        },
        "filters": {
          "type": "array",
          "items": {
            "type": "object",
            "required": ["text"],
            "properties": {
              "text": { "type": "string" },
              "removable": { "type": "boolean" },
              "highlight": { "type": "boolean" }
            }
          }
        },
        "sortOptions": {
          "type": "object",
          "properties": {
            "current": { "type": "string" },
            "options": {
              "type": "array",
              "items": {
                "type": "object",
                "required": ["text", "value"],
                "properties": {
                  "text": { "type": "string" },
                  "value": { "type": "string" }
                }
              }
            }
          }
        },
        "colors": { "type": "object" }
      }
    },
    "product-grid-advanced": {
      "type": "object",
      "required": ["products"],
      "properties": {
        "products": {
          "type": "array",
          "items": {
            "type": "object",
            "required": ["title"],
            "properties": {
              "title": { "type": "string" },
              "category": { "type": "string" },
              "images": {
                "type": "array",
                "items": { "type": "string", "format": "uri" }
              },
              "price": {
                "type": "object",
                "properties": {
                  "current": { "type": "string" },
                  "original": { "type": "string" }
                }
              },
              "rating": { "type": "string" },
              "installments": { "type": "string" },
              "badge": {
                "type": "object",
                "properties": {
                  "text": { "type": "string" },
                  "style": { "type": "string", "enum": ["new", "discount"] }
                }
              }
            }
          }
        },
        "linkText": { "type": "string" },
        "linkHref": { "type": "string" },
        "colors": { "type": "object" }
      }
    },
    "testimonials-section": {
      "type": "object",
      "required": ["reviews"],
      "properties": {
        "title": { "type": "string" },
        "overallRating": {
          "type": "object",
          "properties": {
            "value": { "type": "string" },
            "stars": { "type": "number", "minimum": 0, "maximum": 5 },
            "reviewCount": { "type": "string" }
          }
        },
        "reviews": {
          "type": "array",
          "items": {
            "type": "object",
            "required": ["avatar", "name", "rating", "text"],
            "properties": {
              "avatar": { "type": "string", "format": "uri" },
              "name": { "type": "string" },
              "rating": { "type": "number", "minimum": 0, "maximum": 5 },
              "verified": { "type": "boolean" },
              "text": { "type": "string" }
            }
          }
        },
        "colors": { "type": "object" }
      }
    },
    "benefits-grid": {
      "type": "object",
      "required": ["benefits"],
      "properties": {
        "id": { "type": "string" },
        "tag": { "type": "string" },
        "title": { "type": "string" },
        "description": { "type": "string" },
        "paragraphs": {
          "type": "array",
          "items": { "type": "string" }
        },
        "benefits": {
          "type": "array",
          "items": {
            "type": "object",
            "required": ["icon"],
            "properties": {
              "icon": { "type": "string" },
              "text": { "type": "string" },
              "title": { "type": "string" },
              "description": { "type": "string" }
            }
          }
        },
        "columns": { "type": "number" },
        "colors": { "type": "object" }
      }
    },
    "benefits-grid-ecommerce": {
      "type": "object",
      "required": ["benefits"],
      "properties": {
        "benefits": {
          "type": "array",
          "items": {
            "type": "object",
            "required": ["icon", "title"],
            "properties": {
              "icon": { "type": "string" },
              "title": { "type": "string" },
              "description": { "type": "string" }
            }
          }
        },
        "colors": { "type": "object" }
      }
    },
    "footer-ecommerce-advanced": {
      "type": "object",
      "required": ["brand"],
      "properties": {
        "brand": {
          "type": "object",
          "required": ["logoText"],
          "properties": {
            "logoText": { "type": "string" },
            "logoIcon": { "type": "string" },
            "logoUrl": { "type": "string", "format": "uri" },
            "description": { "type": "string" }
          }
        },
        "socialLinks": {
          "type": "array",
          "items": {
            "type": "object",
            "required": ["icon", "href"],
            "properties": {
              "icon": { "type": "string" },
              "href": { "type": "string", "format": "uri" }
            }
          }
        },
        "columns": {
          "type": "array",
          "items": {
            "type": "object",
            "required": ["title", "links"],
            "properties": {
              "title": { "type": "string" },
              "links": {
                "type": "array",
                "items": {
                  "type": "object",
                  "required": ["text", "href"],
                  "properties": {
                    "text": { "type": "string" },
                    "href": { "type": "string" }
                  }
                }
              }
            }
          }
        },
        "newsletter": {
          "type": "object",
          "properties": {
            "title": { "type": "string" },
            "description": { "type": "string" },
            "placeholder": { "type": "string" },
            "buttonText": { "type": "string" }
          }
        },
        "copyright": { "type": "string" },
        "paymentMethods": {
          "type": "array",
          "items": {
            "type": "object",
            "required": ["icon"],
            "properties": {
              "icon": { "type": "string" }
            }
          }
        },
        "colors": { "type": "object" }
      }
    }
  },
  "additionalProperties": true,
  "patternProperties": {
    "^[a-z-]+$": {
      "type": "object",
      "description": "Componentes dinâmicos (chaves com hífen são componentes)"
    }
  }
}






